### ISSUE TITLE
internal error uploading cache archive failed, reason: read ECONNRESET

### ISSUE THREAD

**Issue by will4j** [falcondev-oss/github-actions-cache-server#144]
## versions

github-actions-cache-server 8.1.1 with helm chart 0.3.0
github-actions-runner 2.326.0 patched according to the latest Getting Started docs
gha-runner-scale-set 0.12.1

API_BASE_URL: http://actions-cache-server.github-runner.svc.cluster.local
ACTIONS_RESULTS_URL: http://actions-cache-server.github-runner.svc.cluster.local/

## workflow configs

```yaml
name: Code Quality Check

on:
  workflow_dispatch:
  pull_request:
    branches:
      - '*'

permissions:
  checks: write
  contents: write
  pull-requests: write

env:
  PROTO_FILES: "*.proto"
  BEHAVE_DATABASE: "example"
jobs:
  code-quality-check:
    name: Code Quality Check
    runs-on: my-self-hosted
    defaults:
      run:
        shell: bash -el {0}
    steps:
      - name: Setup ssh agent
        uses: webfactory/ssh-agent@v0.9.0
        with:
          ssh-private-key: ${{ secrets.DEPLOY_SSH_PRIVATE_KEY }}
      - name: Checkout
        uses: actions/checkout@v4
        with:
          submodules: false
          ssh-key: ${{ secrets.DEPLOY_SSH_PRIVATE_KEY }}
      - name: Checkout protos
        run: |
          git submodule update --init protos
      - uses: actions/setup-python@v5
        with:
          python-version: '3.11'
      - name: Install the latest version of uv
        uses: astral-sh/setup-uv@v6
        with:
          activate-environment: true
          enable-cache: true
          prune-cache: false
      - name: Install dependencies
        run: |
          uv pip install -i https://repo.huaweicloud.com/repository/pypi/simple -r requirements.txt
      - name: Setup environment variables
        run: |
          export PYTHONPATH=${GITHUB_WORKSPACE}:${PYTHONPATH}
          echo "PYTHONPATH=${PYTHONPATH}" >> $GITHUB_ENV
      - name: Init postgres database for behave tests
        run: |
          sudo -u postgres pg_ctlcluster 17 main start
          sudo -u postgres psql -c "ALTER USER postgres PASSWORD 'postgres';"
          sudo -u postgres psql -c "CREATE DATABASE ${{ env.BEHAVE_DATABASE }};"
          for file in sql/*.sql
          do
            sudo -u postgres psql -d ${{ env.BEHAVE_DATABASE }} -f "$file"
          done
      - name: Setup flake8 annotations
        uses: rbialon/flake8-annotations@v1
      - name: Lint with flake8
        continue-on-error: true
        run: |
          flake8 . --count --statistics
      - name: build protos
        run: |
          python -m grpc_tools.protoc -I . --proto_path=protos --python_out=. --grpc_python_out=. --pyi_out=. ${{ env.PROTO_FILES }}
      - name: Run behave tests
        run: |
          behave --tags=~TODO --junit
      - name: Behave Test Reporter
        uses: dorny/test-reporter@v1
        with:
          name: Behave Test Results
          path: reports/TESTS-*.xml
          reporter: java-junit
      - name: Run unit tests with pytest
        run: |
          pytest --cov -W ignore::DeprecationWarning --cov-report=term:skip-covered --junitxml=pytest.xml | tee pytest-coverage.txt
      - name: Pytest coverage comment
        uses: MishaKav/pytest-coverage-comment@main
        with:
          pytest-coverage-path: ./pytest-coverage.txt
          junitxml-path: ./pytest.xml
          title: Coverage Report

```

### logs of workflow run:
```text
**Post Install the latest version of uv**
Post job cleanup.
Saving cache path: /home/runner/.cache/uv
/usr/bin/tar --posix -cf cache.tgz --exclude cache.tgz -P -C /home/runner/_work/****/**** --files-from manifest.txt -z
Sent 0 of 146320341 (0.0%), 0.0 MBs/sec
Sent 0 of 146320341 (0.0%), 0.0 MBs/sec
Sent 0 of 146320341 (0.0%), 0.0 MBs/sec
Sent 0 of 146320341 (0.0%), 0.0 MBs/sec
Sent 0 of 146320341 (0.0%), 0.0 MBs/sec
Sent 0 of 146320341 (0.0%), 0.0 MBs/sec
Sent 0 of 146320341 (0.0%), 0.0 MBs/sec
Sent 0 of 146320341 (0.0%), 0.0 MBs/sec
Sent 0 of 146320341 (0.0%), 0.0 MBs/sec
Sent 0 of 146320341 (0.0%), 0.0 MBs/sec
Sent 0 of 146320341 (0.0%), 0.0 MBs/sec
Sent 0 of 146320341 (0.0%), 0.0 MBs/sec
Sent 0 of 146320341 (0.0%), 0.0 MBs/sec
Sent 0 of 146320341 (0.0%), 0.0 MBs/sec
Sent 0 of 146320341 (0.0%), 0.0 MBs/sec
Sent 0 of 146320341 (0.0%), 0.0 MBs/sec
Warning: uploadCacheArchiveSDK: internal error uploading cache archive: request to http://actions-cache-server.github-runner.svc.cluster.local/upload/6940816923?comp=block&blockid=YTk4N2QyZDEtYTc3Yy00NmUxLTliZDMtY2UwMTI3MDdjZDM5MDAwMDAwMDAwMDAx failed, reason: read ECONNRESET
Sent 0 of 146320341 (0.0%), 0.0 MBs/sec
Warning: Failed to save: request to http://actions-cache-server.github-runner.svc.cluster.local/upload/6940816923?comp=block&blockid=YTk4N2QyZDEtYTc3Yy00NmUxLTliZDMtY2UwMTI3MDdjZDM5MDAwMDAwMDAwMDAx failed, reason: read ECONNRESET
cache saved with the key: setup-uv-1-x86_64-unknown-linux-gnu-3.11.13-225b11a5fb49472dc5546a7a04ad2125b205cb6fee8fa087c17feb4b6180f6cd
```
### logs of actions cache server
```text
[cache-server-node-1] ⚙ Request: POST /twirp/github.actions.results.api.v1.CacheService/GetCacheEntryDownloadURL
[cache-server-node-1] ⚙ Finding key match { key:
   'setup-uv-1-x86_64-unknown-linux-gnu-3.11.13-225b11a5fb49472dc5546a7a04ad2125b205cb6fee8fa087c17feb4b6180f6cd',
  version: '859715d8019ca9fecbe723a01f4deb0e61556c879c755004e70417284a79dd2f',
  restoreKeys: undefined }
[cache-server-node-1] ⚙ No exact primary matches found
[cache-server-node-1] ⚙ No restore keys provided
[cache-server-node-1] ⚙ Get: Cache entry not found { keys:
   [ 'setup-uv-1-x86_64-unknown-linux-gnu-3.11.13-225b11a5fb49472dc5546a7a04ad2125b205cb6fee8fa087c17feb4b6180f6cd' ],
  version: '859715d8019ca9fecbe723a01f4deb0e61556c879c755004e70417284a79dd2f' }
[cache-server-node-1] ⚙ Response: POST /twirp/github.actions.results.api.v1.CacheService/GetCacheEntryDownloadURL > 200
[cache-server-node-1] ⚙ Request: POST /twirp/github.actions.results.api.v1.CacheService/CreateCacheEntry
[cache-server-node-1] ⚙ Reserve: { key:
   'setup-uv-1-x86_64-unknown-linux-gnu-3.11.13-225b11a5fb49472dc5546a7a04ad2125b205cb6fee8fa087c17feb4b6180f6cd',
  version: '859715d8019ca9fecbe723a01f4deb0e61556c879c755004e70417284a79dd2f' }
[cache-server-node-1] ⚙ Reserve: { key:
   'setup-uv-1-x86_64-unknown-linux-gnu-3.11.13-225b11a5fb49472dc5546a7a04ad2125b205cb6fee8fa087c17feb4b6180f6cd',
  version: '859715d8019ca9fecbe723a01f4deb0e61556c879c755004e70417284a79dd2f',
  uploadId: 6940816923 }
[cache-server-node-1] ⚙ Response: POST /twirp/github.actions.results.api.v1.CacheService/CreateCacheEntry > 200
```

## questions
I have no idea why upload failed, the error msg is obscure and I'm strange to nodejs, any clue?
I have tried to degrade with actions-runner 2.324.0 2.325.0 2.326.0, nothing help for. also doubt if its about github new cache service(v2) api, but without obvious evidence. help me out of this trouble, plz.

**Comment by DrJume** [comment]
Maybe the cache server pod is getting restarted? Does it show any restarts in kubernetes?

**Comment by will4j** [comment]
> Does it happen all the time or just randomly?

It happens all the time, and the cache server is running and not getting restarted. 
curl ${ACTIONS_RESULTS_URL} returns OK from runner pod.

**Comment by LouisHaftmann** [comment]
It looks like the upload requests don't even reach the cache server (no log regarding upload). Could you try just making a request to the upload endpoint from your github actions workflow?

**Comment by will4j** [comment]
Try run the workflow again and below is full logs with timestamp, hope I did not miss something:

```text
Wed, 16 Jul 2025 12:05:22 GMT
Post job cleanup.
Wed, 16 Jul 2025 12:05:22 GMT
Saving cache path: /home/runner/.cache/uv
Wed, 16 Jul 2025 12:05:22 GMT
/usr/bin/tar --posix -cf cache.tgz --exclude cache.tgz -P -C /home/runner/_work/car-spray-core/car-spray-core --files-from manifest.txt -z
Wed, 16 Jul 2025 12:05:36 GMT
Sent 0 of 146321772 (0.0%), 0.0 MBs/sec
Wed, 16 Jul 2025 12:05:37 GMT
Sent 0 of 146321772 (0.0%), 0.0 MBs/sec
Wed, 16 Jul 2025 12:05:38 GMT
Sent 0 of 146321772 (0.0%), 0.0 MBs/sec
Wed, 16 Jul 2025 12:05:39 GMT
Sent 0 of 146321772 (0.0%), 0.0 MBs/sec
Wed, 16 Jul 2025 12:05:40 GMT
Sent 0 of 146321772 (0.0%), 0.0 MBs/sec
Wed, 16 Jul 2025 12:05:42 GMT
Sent 0 of 146321772 (0.0%), 0.0 MBs/sec
Wed, 16 Jul 2025 12:05:42 GMT
Sent 0 of 146321772 (0.0%), 0.0 MBs/sec
Wed, 16 Jul 2025 12:05:45 GMT
Sent 0 of 146321772 (0.0%), 0.0 MBs/sec
Wed, 16 Jul 2025 12:05:51 GMT
Sent 0 of 146321772 (0.0%), 0.0 MBs/sec
Wed, 16 Jul 2025 12:05:51 GMT
Sent 0 of 146321772 (0.0%), 0.0 MBs/sec
Wed, 16 Jul 2025 12:05:51 GMT
Sent 0 of 146321772 (0.0%), 0.0 MBs/sec
Wed, 16 Jul 2025 12:05:51 GMT
Sent 0 of 146321772 (0.0%), 0.0 MBs/sec
Wed, 16 Jul 2025 12:05:51 GMT
Sent 0 of 146321772 (0.0%), 0.0 MBs/sec
Wed, 16 Jul 2025 12:05:51 GMT
Sent 0 of 146321772 (0.0%), 0.0 MBs/sec
Wed, 16 Jul 2025 12:05:51 GMT
Sent 0 of 146321772 (0.0%), 0.0 MBs/sec
Wed, 16 Jul 2025 12:05:51 GMT
Sent 0 of 146321772 (0.0%), 0.0 MBs/sec
Wed, 16 Jul 2025 12:05:51 GMT
Warning: uploadCacheArchiveSDK: internal error uploading cache archive: request to http://actions-cache-server.github-runner.svc.cluster.local/upload/3833537448?comp=block&blockid=ZmJjYjJhYWYtNTg5ZC00MzI5LWJiOWYtODk2MDI1ODgxZmRhMDAwMDAwMDAwMDAw failed, reason: read ECONNRESET
Wed, 16 Jul 2025 12:05:51 GMT
Sent 0 of 146321772 (0.0%), 0.0 MBs/sec
Wed, 16 Jul 2025 12:05:51 GMT
Warning: Failed to save: request to http://actions-cache-server.github-runner.svc.cluster.local/upload/3833537448?comp=block&blockid=ZmJjYjJhYWYtNTg5ZC00MzI5LWJiOWYtODk2MDI1ODgxZmRhMDAwMDAwMDAwMDAw failed, reason: read ECONNRESET
Wed, 16 Jul 2025 12:05:51 GMT
cache saved with the key: setup-uv-1-x86_64-unknown-linux-gnu-3.11.13-225b11a5fb49472dc5546a7a04ad2125b205cb6fee8fa087c17feb4b6180f6cd
```
```text
2025-07-16T20:05:24.852553860+08:00 [cache-server-node-1] ⚙ Request: GET /
2025-07-16T20:05:24.852874988+08:00 [cache-server-node-1] ⚙ Response: GET / > 200
2025-07-16T20:05:34.671138681+08:00 [cache-server-node-1] ⚙ Request: POST /twirp/github.actions.results.api.v1.CacheService/CreateCacheEntry
2025-07-16T20:05:34.671497446+08:00 [cache-server-node-1] ⚙ Reserve: { key:
2025-07-16T20:05:34.671507761+08:00    'setup-uv-1-x86_64-unknown-linux-gnu-3.11.13-225b11a5fb49472dc5546a7a04ad2125b205cb6fee8fa087c17feb4b6180f6cd',
2025-07-16T20:05:34.671509736+08:00   version: '859715d8019ca9fecbe723a01f4deb0e61556c879c755004e70417284a79dd2f' }
2025-07-16T20:05:34.695151976+08:00 [cache-server-node-1] ⚙ Reserve: { key:
2025-07-16T20:05:34.695176104+08:00    'setup-uv-1-x86_64-unknown-linux-gnu-3.11.13-225b11a5fb49472dc5546a7a04ad2125b205cb6fee8fa087c17feb4b6180f6cd',
2025-07-16T20:05:34.695179928+08:00   version: '859715d8019ca9fecbe723a01f4deb0e61556c879c755004e70417284a79dd2f',
2025-07-16T20:05:34.695182477+08:00   uploadId: 3833537448 }
2025-07-16T20:05:34.695442161+08:00 [cache-server-node-1] ⚙ Response: POST /twirp/github.actions.results.api.v1.CacheService/CreateCacheEntry > 200
2025-07-16T20:05:34.851490709+08:00 [cache-server-node-1] ⚙ Request: GET /
2025-07-16T20:05:34.851754624+08:00 [cache-server-node-1] ⚙ Response: GET / > 200
2025-07-16T20:05:34.852094388+08:00 [cache-server-node-1] ⚙ Request: GET /
2025-07-16T20:05:34.852793070+08:00 [cache-server-node-1] ⚙ Response: GET / > 200
2025-07-16T20:05:44.851577970+08:00 [cache-server-node-1] ⚙ Request: GET /
2025-07-16T20:05:44.851935463+08:00 [cache-server-node-1] ⚙ Response: GET / > 200
2025-07-16T20:05:44.852271178+08:00 [cache-server-node-1] ⚙ Request: GET /
2025-07-16T20:05:44.852500187+08:00 [cache-server-node-1] ⚙ Response: GET / > 200
2025-07-16T20:05:54.851857500+08:00 [cache-server-node-1] ⚙ Request: GET /
2025-07-16T20:05:54.852604869+08:00 [cache-server-node-1] ⚙ Request: GET /
2025-07-16T20:05:54.852626225+08:00 [cache-server-node-1] ⚙ Request: GET /
2025-07-16T20:05:54.853052434+08:00 [cache-server-node-1] ⚙ Response: GET / > 200
2025-07-16T20:06:04.851101548+08:00 [cache-server-node-1] ⚙ Request: GET /
2025-07-16T20:06:04.851678641+08:00 [cache-server-node-1] ⚙ Response: GET / > 200
2025-07-16T20:06:04.852195328+08:00 [cache-server-node-1] ⚙ Request: GET /
2025-07-16T20:06:04.852515443+08:00 [cache-server-node-1] ⚙ Response: GET / > 200
2025-07-16T20:06:14.851335695+08:00 [cache-server-node-1] ⚙ Request: GET /
2025-07-16T20:06:14.851815986+08:00 [cache-server-node-1] ⚙ Response: GET / > 200
```

**Comment by LouisHaftmann** [comment]
If the runner can reach the api routes but not the upload route the issue might be a misconfigured `API_BASE_URL`.
The logs you provided suggest that it *is* configured correctly. 

How have you setup the cache server and runners? Maybe Kubernetes limits the size of network requests?. I don't think this is a problem with the cache server.

**Comment by will4j** [comment]
I'm using filesystem & sqlite, no OOMKilled found from cache server pod.

**Comment by LouisHaftmann** [comment]
Try using postgres or mysql as db

**Comment by will4j** [comment]
It do has nothing to do with the cache server, turns out when using https_proxy in github runner, the `noProxy` seems not working when upload cache archives.

I use tcpdump to capture packages from runner, and expect to see request `http://actions-cache-server.github-runner.svc.cluster.local/upload/xxx` but not found, instead a lot of request to proxy(port 7890) after `POST /twirp/github.actions.results.api.v1.CacheService/CreateCacheEntry` . then checkout proxy logs and found Unexpected `svc.cluster.local:80 error: couldn't find ip` which should filtered by `noProxy` env variable.

Here is what's going on, runner request CreateCacheEntry to actions-cache-server successfully(which go without proxy), then start to upload cache archive, uploadCacheArchiveSDK send package to actions-cache-server(which go unexpected with proxy) and can't establish conn, so a `ECONNRESET` returned.

```yaml
gha-runner-scale-set:
  ## controller, the listener and the runner of this scale set.
  proxy:
    http:
      url: "http://x.x.x.x:7890"
    https:
      url: "http://x.x.x.x:7890"
    noProxy:
      - 127.0.0.1
      - localhost
      - 10.233.0.1
      - svc.cluster.local
```

### tcpdump packages from runner
```text
00:57:57.863624 IP troy-self-hosted-rvgqc-runner-td2vp.43768 > actions-cache-server.github-runner.svc.cluster.local.http: Flags [P.], seq 1:2623, ack 1, win 64, options [nop,nop,TS val 2017136273 ecr 1457781317], length 2622: HTTP: POST /twirp/github.actions.results.api.v1.CacheService/CreateCacheEntry HTTP/1.1
00:57:57.863643 IP actions-cache-server.github-runner.svc.cluster.local.http > troy-self-hosted-rvgqc-runner-td2vp.43768: Flags [.], ack 2623, win 68, options [nop,nop,TS val 1457781318 ecr 2017136273], length 0
00:57:57.888028 IP actions-cache-server.github-runner.svc.cluster.local.http > troy-self-hosted-rvgqc-runner-td2vp.43768: Flags [P.], seq 1:268, ack 2623, win 68, options [nop,nop,TS val 1457781342 ecr 2017136273], length 267: HTTP: HTTP/1.1 200 OK
00:57:57.888064 IP troy-self-hosted-rvgqc-runner-td2vp.43768 > actions-cache-server.github-runner.svc.cluster.local.http: Flags [.], ack 268, win 64, options [nop,nop,TS val 2017136297 ecr 1457781342], length 0
00:57:57.901723 IP troy-self-hosted-rvgqc-runner-td2vp.52750 > 100.64.0.10.7890: Flags [S], seq 3099100630, win 64860, options [mss 1410,sackOK,TS val 872755965 ecr 0,nop,wscale 10], length 0
00:57:57.901873 IP troy-self-hosted-rvgqc-runner-td2vp.52766 > 100.64.0.10.7890: Flags [S], seq 1179527763, win 64860, options [mss 1410,sackOK,TS val 872755965 ecr 0,nop,wscale 10], length 0
00:57:57.901959 IP troy-self-hosted-rvgqc-runner-td2vp.52772 > 100.64.0.10.7890: Flags [S], seq 957117922, win 64860, options [mss 1410,sackOK,TS val 872755965 ecr 0,nop,wscale 10], length 0
00:57:57.902272 IP 100.64.0.10.7890 > troy-self-hosted-rvgqc-runner-td2vp.52750: Flags [S.], seq 3170000462, ack 3099100631, win 65084, options [mss 1240,sackOK,TS val 2335832338 ecr 872755965,nop,wscale 7], length 0
```
### logs from proxy
```text
2025-07-18T08:57:57.970361+08:00 ********[110345]: time="2025-07-18T08:57:57+08:00" level=warning msg="[TCP] dial DIRECT (match DomainSuffix/local) ****:2919 -->
actions-cache-server.github-runner.svc.cluster.local:80 error: couldn't find ip"
```

Next step, I will try to resolve the proxy problem. thank you all guys for suggestions above, it helps me a lot to narrow down the scope of the problem and find this hidden clue.

**Comment by will4j** [comment]
Everything works fine after changing gha-runner-scale-set helm values, replace `svc.cluster.local` with `.svc.cluster.local`.

```yaml
    noProxy:
      - 127.0.0.1
      - localhost
      - 10.233.0.1
--    - svc.cluster.local
++    - .svc.cluster.local
      - troyrobot.top
```

Seems `no_proxy` is not consistently parsed by different client.

**Comment by will4j** [comment]
Everything works fine after changing gha-runner-scale-set helm values, replace `svc.cluster.local` with `.svc.cluster.local`.

```yaml
    noProxy:
      - 127.0.0.1
      - localhost
      - 10.233.0.1
--    - svc.cluster.local
++    - .svc.cluster.local
```

Seems `no_proxy` is not consistently parsed by different client.

**Comment by LouisHaftmann** [comment]
Thanks for sharing!
